{
    "job_owner": "Albert",
    "creation_date": "2024-05-08",
    "job_type": "UNIQUE",
    "target_cloud_run": "first-job", 
    "variables" : {
        "project_id": "model-zoo-382809",
        "dataset_id": "raw_data_air_quality",
        "report_type": "CATCHUP",
        "start_time": "2023-05-25",
        "end_time": "2024-05-25"
    }
}